Exam Name,Section,Question,Answer1,Answer2,Answer3,Answer4
mock exam4,reading,Which choice best describes what happens in the passage?,One character argues with another character who intrudes on her home,One character receives a surprising request from another character,One character reminisces about choices she has made over the years,One character criticizes another character for pursuing an unexpected course of action
,reading,Which choice best describes the developmental pattern of the passage?,A careful analysis of a traditional practice,A detailed depiction of a meaningful encounter,A definitive response to a series of questions,A cheerful recounting of an amusing anecdote
,writing,writing question,NO CHANGE,scientists: and,"scientists, and","scientists, and,"
,writing,"To make this paragraph most logical, sentence 5 should be placed",where it is now,after sentence 1.,after sentence 2.,after sentence 3.
,math1,"If x k − 1 3 = and k = 3, what is the value of x ?",4,4,9,10
,math1,"For i = −1 , what is the sum (7 + 3 ) + (−8 + 9 ) i i ?",−1 + 12i, −1 − 6i,15 + 12i,15 − 6i
,math2,"If 16 + 4x is 10 more than 14, what is the value of 8x ?",2,6,16,80
,math2,Which of the following graphs best shows a strong negative association between d and t ?,A   ,B  ,C ,D
